date;url;notes
2022-04-13;https://twitter.com/lhfang/status/1514274294968512514;Despite witnessing an attack that was very likely to have been committed by a “black identity extremis[t]”, the left argues that black identity extremism does not exist and should not be investigated by the FBI. This is the logical endpoint for Woke ideology and its assertion that racism only targets black people and not white people: they maintain that white supremacy exists and motivates terrorists (which is undoubtedly true), but that black supremacy does not exist and therefore can never be the reason behind an attack (an attack which should not be regarded by the FBI as terrorism). In the eyes of the left, it is not acceptable for extremists to try to kill all black people (indeed, we can ALL agree that this ISN’T acceptable), but it IS acceptable to try to kill all white people. As adherents of a radical ideology that preaches that racism is evil and all white people are racist, the Woke cannot possibly believe other than that killing all white people is acceptable. How is Wokeism not clearly seen for the extremist ideology that it is? How is it that people can give violence like that in New York this week a pass (at least insofar as labeling it as identity extremist terrorism)?
2022-04-14;https://www.axios.com/biden-economists-inflation-growth-stimulus-288d6163-4438-4880-a71c-39ded77cccac.html;Biden’s own White House Council of Economic Advisers published a report assessing that the current staggeringly high inflation is primarily the result of the massive $1.9 trillion stimulus package which the Democrats spearheaded. Apologists for Biden have been attributing inflation to pandemic-related disruptions to the supply chain, in an effort to exculpate Biden from blame for inflation. But these apologists have now been clearly proven wrong, by Biden’s own advisors. It turns out that printing trillions of dollars has a greater impact on inflation than delays in overseas production and shipping, something that anyone who took a high school economics course should be able to tell you, and yet which diehard Democrat supporters stubbornly denied. 
2022-04-14;https://www.axios.com/congress-ukraine-taiwan-f50091af-a499-4671-8bdf-130ff376a807.html;After Biden’s inability to deter Russia from invading Ukraine was made plain for all the world to see, Congress is now (wisely) worried that China will make a move on Taiwan. How much weaker can Biden come across if our own Congress has reason to believe Taiwan will be the next domino to fall? It would be one thing if China or some unaligned entity suggested or conjectured that Taiwan would be the next target of invasion. It’s quite another for the US Congress, which is party to intelligence briefings, to voice concern over Taiwan. If Congress—and a bipartisan group at that—thinks Taiwan is in danger, there is reason to take its assessment seriously. An uneasy equilibrium has persisted between Taiwan and China for half a century, and yet it was under Biden’s watch that the danger to Taiwan escalated to truly alarming degrees. What does this say about his leadership? That his leadership weak—in fact, that we acknowledge that his leadership is weak. 
2022-04-14;https://twitter.com/DefiantLs/status/1514738236207337477;The same Business Insider that had nothing critical to say about Bezos buying the Washington Post is condemning Musk for attempting to purchase Twitter with nobler stated intentions than any billionaire media owner ever: restoring free speech to one of the web’s largest social media platforms. This isn’t to say that Musk will honor these laudable intentions. But when billionaires like Bezos didn’t so much as HINT at any commendable rationale for their purchase, Business Insider, a media outlet itself, said nothing to challenge it. 
2022-04-14;https://twitter.com/disclosetv/status/1514670249316077569;According to Fauci “you use lockdowns to get people vaccinated”: the same lockdowns which studies show only reduced deaths by 0.5% and led to increased suicide rates, increased drug abuse rates, increased domestic abuse rates, plummeting educational outcomes, and the economic devastation of the middle class, for the same vaccines that failed to prevent transmission as advertised, are shown to be less effective than advertised, and are shown to be more dangerous in their side-effects than advertised. More than any of that, it is manipulative and unethical to justify a public health control to citizens as a way of reducing spread when it was really intended to coerce them into taking an experimental gene therapy. Essentially, the emotional and psychological anguish of the lockdown is intended, according to Fauci, to be so excruciating that citizens break down and take an experimental drug whose manufacturers tried to hide regulatory data from them for 80 years. Fauci has furnished yet more proof that he never deserved the public trust, abusing his power as the nation’s top public health policymaker to coerce Americans into taking medical treatments they would not have otherwise taken. 
2022-04-15;https://www.reuters.com/technology/twitter-adopts-poison-pill-fight-musk-2022-04-15/;In order to keep Musk from purchasing Twitter, which he has vowed to realign with preserving free speech, at a rate above what its shares are currently worth, Twitter has adopted a so-called “poison pill” plan to discount share prices to existing shareholders. The “shareholder rights” plan stipulates that if any single entity attempts to purchase 15% of Twitter’s shares or more, other shareholders will be offered the chance to buy shares at a price below their current value, which would reduce the controlling stake of this entity. Declining a cash deal offering more than the current share price times the total shares in circulation will already have the effect of dropping share prices. But to then implement a mechanism which will drop the price to allow shares to be concentrated out of Musk’s hands will drop the share value even further. Why would Twitter, which has historically struggled to turn a profit and sorely lags in technical innovation, turn down a better deal than they have any right to expect, and than they have ever been offered previously? It’s not as though it is uncommon for individual billionaires to solely own and/or control traditional and social media companies, despite claims by the deal’s opponents to the contrary. The whole reason behind Musk’s offer is to restore Twitter’s professed value of free speech, and he has voiced no other intentions to significantly depart from the company’s current business philosophy. The fact that Twitter is scrambling to avoid the best deal they have ever been offered (and probably ever will be) shows just how desperate its current owners are to maintain their ability to NOT respect free speech… i.e. to censor. Because if Twitter DID already respect free speech, what would be the harm in taking more money than they have any right to expect, and keep operating as usual? The fact that they aren’t doing this proves that they use Twitter to control the narrative of online discourse, and they know it. Moreover, critics condemnation of “oligarchs” controlling the flow of information rings hollow when these same critics (such as Robert Reich) don’t bat an eye when Bezos purchased the Washington Post, or when Bradley bought Atlantic Media. These critics don’t actually care if the wealthy control the media—they just can’t stand it when billionaires (or anyone, really) that don’t agree with their authoritarian worldview own media companies. The shameless, hypocritical hand-wringing is so illustrative of how the pro-left elites believe the world should be run, and that way is to suppress all dissent, burning any amount of money to do so. The board of Twitter is willing to lose billions of dollars that their company has no prayer of earning through its pathetic attempts at a business model, all to maintain the ability to censor even the faintest murmur of dissent against their political orthodoxy. Anyone who values freedom of speech, and indeed freedom of thought, can never forget this. 
2022-04-18;https://www.axios.com/inflation-food-gas-prices-expensive-fb10e559-321b-43d8-966b-c65a5ec624a2.html;According to analysis from Axios, a relatively unbiased news media outlet, the value of the American dollar is not going to rebound once inflation is addressed, but will remain depressed. If this assessment turns out to be accurate, By definition, this means that inflation is not the transitory problem that Democrat apologists insist that it is. The fact that Democrats at the federal government level can’t get inflation under control even with the lowest COVID numbers since the pandemic began, and the associated lifting of all operating restrictions on businesses, just shows the staggering degree of their incompetence. 
2022-04-19;https://twitter.com/libsoftiktok/status/1516638132422299652;Lorenz, the journalist who used the resources of one of America’s biggest newspapers to expose the identity of an anonymous Twitter account (Libs of TikTok) which merely republished verbatim videos posted by radical leftists (many of them employed as teachers in public schools), posted a video weeks prior decrying the journalistic unethical-ness of outing an anonymous person and not permitting them to comment on the story. It goes without saying that, of course, Lorenz did not request a comment from the owner of the Libs of TikTok Twitter account before revealing the real-life identity and home address of the account’s owner, the very thing Lorenz cried was journalistically unethical. For the left, their opponents deserve no ethical treatment, and instead deserve to be exposed for anyone to threaten merely for revealing unflattering truths about what the left believes. 
2022-04-21;https://www.axios.com/us-covid-cases-on-the-rise-in-mid-atlantic-pacific-northwest-424b7d8a-4515-412a-8f24-3e58e6746e26.html;All of the states with the highest rates of mRNA vaccination are now experiencing the fastest rise in COVID cases, and simultaneously all the states with the lowest vaccination rates are seeing a DECREASE in COVID cases. New York, Massachusetts, Vermont, and Washington, DC are all leading the way in COVID case increases, with California, Oregon, and Washington state close behind. Meanwhile Georgia, Alabama, Mississippi, and the Carolinas are seeing decreases in cases. Texas and Florida are experiencing case increases as well, but at a slower rate than New England and the Pacific Northwest. If the mRNA “vaccine” is so effective, this shouldn’t be possible. If, indeed, another COVID wave is on its way in the US (as the previous two summers would suggest is likely), then an effective vaccine should lead to the least-vaccinated states seeing the fastest rise in cases, and the most-vaccinated states seeing slower increases. Yet the opposite is occurring. At this point, how can anyone stand by the vaccine and continue to insist on its effectiveness, to say nothing of employee and private business patron vaccine requirements? So why is this happening? There are so many factors that it’s hard to say. One likely contributing factor is the fact that, with every injection of the mRNA sequence, the injectee’s body perceives itself as being under attack, and an immune response is triggered. But this is not the same kind of mild immune response that results from taking a traditional inactivated virus vaccine, where incapacitated viral particles are injected and the immune system attacks the foreign bodies without resistance. When the mRNA instructions enter your body, cells pick them up and execute them. Every cell exposed to the mRNA sequence is another producer of spike proteins that the immune system must respond to. But cells don’t just stay still—as a regular prat of human cellular metabolism, cells divide to produce exact copies. If these copies have the mRNA sequence, they produce spike proteins, too. So unlike traditional inactivated virus vaccines where a static number of viral particles are introduced and then destroyed (to produce antibodies), with every cell division, more spike protein producers pop into existence, exponentially increasing spike protein presence. And recall that studies show the spike proteins to be cytotoxic. Indeed, this behavior can be inferred from the fact that studies show that immune responses is suppressed in the weeks following an mRNA “vaccine” injection, because the immune system is working hard to fight an exponentially increasing quantity of cytotoxic spike proteins. So how can this have any other effect than to leave the vaccinated MORE vulnerable to a real COVID infection, especially as the virus only continues to mutate away from the genetic sequence which the mRNA “vaccines” encode?
2022-04-21;https://twitter.com/lwoodhouse/status/1517287249632653312;When a Florida judge struck down the CDC’s public transit mask mandate solely for exceeding its statutory authority—and not on the presence or absence of the merit policy—Fauci essentially stated that the CDC should get to act above the law if it feels it has to. Again, the judge wasn’t saying that mask mandates are good or bad. The judge merely ruled that the CDC does not have the power under current law to make impose that policy on the entire nation, which is an intuitive and reasonable ruling. Unelected bureaucrats should not be able to dictate what Americans must do to travel. Such power should only be vested in an elected official, so that decisions of such consequence can be reviewed by voters at the ballot box. But Democrats don’t believe the democratic process should be able to obstruct their policy aims. How is this attitude anything other than authoritarian? 
2022-04-22;https://www.axios.com/substance-abuse-worker-shortage-covid-3884069d-91a5-4a8b-89cd-09a09b62d3e2.html;The labor shortage, which is partly driving inflation (as less workers mean that supply of the products they produce goes down), is being exacerbated by drug abuse, which spiked during the pandemic due to lockdowns that weren’t effective in reducing COVID deaths anyway. It is indisputable that the lockdown drove record rates of drug abuse. Studies also show that the lockdowns only reduced COVID deaths by 0.5% in the US. For that trade-off, the US lost a large chunk of its workforce. When there are fewer workers, the output of the goods and services they produce goes down and/or the cost f those goods and services increases. This is simple economics. QED, the ineffective lockdown policies of the Democrats have been proven to cause the current staggering inflation in yet another way. It should be evident by this point to anyone who reviews the real data that this inflation was avoidable, and that signature Democrat pandemic policies are why we failed to avoid it. 
2022-04-25;https://www.reuters.com/technology/human-rights-groups-raise-hate-speech-concerns-after-musks-takeover-twitter-2022-04-25/;The ACLU, which historically staunchly defended the values of free speech—even if doing so meant protecting hateful speech—is now standing against Musk’s purchase of Twitter on the grounds that it will increase the amount of hateful speech on the platform. In the past, the ACLU has defended literal Nazis in their right to mount demonstrations of their hateful ideology purely because that group has the same First Amendment rights as any other in America. The ACLU’s defense of free speech, in this and similar cases, rested on the principle that a threat to any American’s rights is a threat to all Americans’ rights. If the government successfully censors the speech of one group, no matter how abhorrent the group’s views may be, it sets the legal precedent for the censorship of any other group. Once that door is open, it cannot be closed. Now, however, the ACLU has forfeit all of its principles, prostituted every ounce of its integrity, to leave free speech for dead in order to don the politically fashionable (in the left circles it travels in) garb of countering “hate speech”. The organization is condemning Musk for expressing the desire to restore the value that the ACLU itself long claimed to champion purely to curry favor with its left-wing donors. The ACLU is attempting to veil its nakedly partisan objectives behind the pretext that it is against billionaires controlling speech. When it comes to Facebook, though, the ACLU takes the opposite view from its view of Musk’s Twitter: Facebook is flagging TOO MUCH content as hate speech out of a desire to censor views it dislikes. Under this double-standard, if the ACLU doesn’t like certain content, you can never “moderate” (i.e. censor) it enough, but if the ACLU does like certain content, it is unacceptable that it gets moderated. The sad case of the ACLU’s descent into a partisan servant of the Democrats is proof that, if the left gains control of any body or institution, it will cease to have any ideological consistency or principles. Rather, it will use anything at its disposal to advance its agenda. 
2022-04-25;https://blockclubchicago.org/2022/04/25/lincoln-park-neighbors-look-to-hire-private-security-firm-to-patrol-streets-raising-concerns-from-some/;Yet another neighborhood in Chicago, this time one of the simultaneously richest and most politically left in the city, has elected to protect itself using private security. Just as anyone with even the most rudimentary grasp of game theory could have predicted, once the police responded to the disincentive to use force against criminal perpetrators (for fear of losing their job and facing criminal charges), crime increased. The residents of Lincoln Park led the way in the BLM and “Defund the Police” movements that signaled to cops that they are better off sitting on their hands and collecting a paycheck than attempting to stop violent crime and risking their livelihood and freedom when activists condemn them. So now those same people who pushed the police away are now taking their security into their own hands. Who will be easier to hold accountable for racial profiling or excessive force, some private security contractor or a taxpayer-funded and (elected) mayor-controlled law enforcement body? Which do you think is going to be more careful to respect the rights of minorities, a company that answers only to its clients (the neighborhood), or a police force that the entire city can vote on? How does replacing police with private security make life better for non-white individuals? 
2022-04-25;https://www.bbc.co.uk/news/world-us-canada-61218611;The number of police officers killed while on duty has risen by 59% from 2020 to 2021, according to the FBI. Murders in general have increased by anywhere from 29% to 44% since 2019. This is no doubt due the left social justice movements deincentivizing police from doing their job when their job demands for them to use force to stop criminal violence. As explained numerous times here, when any cop who uses a weapon is immediately targeted by activists and hauled before a prosecutor, cops will use their weapons less often—perversely, cops are not reprimanded when allowing crime to go unchecked, but only when they attempt to stop it. To provide a fair reading of events, crime has also likely resulted from the economic devastation wrought by the pandemic. But here, too, the blames rests with the political left: it was Democrats who insisted on keeping the economy shut down for over a year for lockdowns which only decreased COVID deaths by 0.5%. Rising crime is one thing, but targeting the police specifically is quite another. The left is quick to decry any negative characterization of an identity group (regardless of whether or not what was expressed was factually and empirically hateful by the definition of hate crime laws) because it supposedly increases violence against that group. There is nothing wrong with this logic per se, but yet they don’t apply it to opposing groups. The left condemns vitriolic speech against non-white people, but not against white people or police, even when it correlates with increases in violence against these groups. In fact, the left actively expresses vicious speech targeting white people and police. This is yet another realm in which the left insists that they get to write the rules that their opponents must follow, while exempting themselves. 
2022-04-25;https://www.axios.com/twitter-elon-musk-deal-065c90cd-d584-4126-b5c1-457f2591b792.html;After swearing it would resist tooth and nail, the board of Twitter gave in and let the company be sold to Elon Musk in the face of a far better offer than the company deserved given how it practically burns money. It turns out most leftists have no principles when it inconveniences them or goes against their financial interests. If Musk’s takeover of the Twitter and attendant vow to restore free speech on the platform was the grave threat to peoples’ safety that the board claimed, why is the board rolling over so easily? If, as they claimed, this purchase threatened to bring a deluge of “hate speech” to Twitter, wouldn’t they be fighting harder to keep Musk away? Shouldn’t morality be more important than money? The fact that the Twitter board is choosing money over morals shows just how sincere (i.e. completely insincere) their line of argument was. 
2022-04-26;https://blockclubchicago.org/2022/04/26/60-of-americans-have-now-had-covid-with-omicron-fueling-surge-this-winter-cdc-says/;CDC data shows that 60% of Americans, including 75% of American children under 12, have had COVID, showing how utterly ineffective the vaccine is and how overwhelmingly safe children are from dangerous COVID outcomes (given the simultaneously minuscule COVID death numbers for children in this age group). If the mRNA “vaccines” are so effective, how is it that 60% of Americans are fully vaccinated (even more if counting even one dose) and yet 60% of Americans have had COVID? Even if every unvaccinated person had COVID (which is not the case), that would mean that 1/3 of fully vaccinated Americans caught COVID anyway. And if only half of unvaccinated Americans caught COVID (which would still be an incredibly high proportion), that would mean that 2/3 of fully vaccinated Americans caught COVID. The true proportions are probably somewhere in the middle, but that means that at best taking the “vaccine” is barely more effective than not taking it. This data also means that there is basically no case for vaccinating children against COVID. As of April 20, 2022, CDC data indicates that 386 Americans age 0 to 4 years and 781 Americans aged 5 to 18 years died from COVID, for a total of 1167 children. The new CDC data indicates that 75% of children under 12 years old contracted COVID, so even if we compare that against all 1167 child deaths, which would be too many considering that it includes deaths of children 12 and older, this would mean that COVID poses almost no threat to children. There are 48 million children age 0 to 11 in the US. At an infection rate of 75%, that means that 36 million children have been infected with COVID. So if out of those 36 million children, only 1167 died (which, again, is an over-count), how can any rational person call COVID a serious threat to children meriting vaccination with experimental vaccines which (as shown above) aren’t even that effective on adults? That is a COVID death rate of 0.0032%! Considering that most (75% of) children got COVID anyway, why risk the side effects of the vaccine to avert the extremely unlikely chance of a child dying of COVID? Vaccine apologists argue that COVID has side-effects, but even so, if most children have had COVID already, why risk more side effects by vaccinating them when it is extremely unlikely they will die? With every new data release, the vaccine is shown to be less and less effective, posing downsides for very little upside.
2022-04-27;https://twitter.com/johnrobb/status/1519317988645773312;The US government is openly advertising, for Russia and anyone else to see, that it provided Ukraine intelligence with which it then killed Russian soldiers. How would Russia interpret this in any other way than an act of US aggression? Why does the US think that Russia will not retaliate in some way, increasing the chances of open war between the US and Russia? It’s one thing to secretly supply Ukraine with US intelligence, which is dangerous enough since it has the potential to be discovered. It’s another thing to openly state that such intelligence is being shared. At every turn, the US government is stepping up its provocation of Russia, as if they’re daring Russia to attack the US. By the sheer recklessness of these actions, it is clear that those at the highest levels of our government have no grasp of the threat of global nuclear annihilation that they are flirting with. 
