date;url;notes
2022-01-16;https://thepostmillennial.com/msnbc-contributor-calls-the-gop-a-front-for-a-terrorist-movement;A panelist on MSNBC characterized the Republican Party as a “front for a terrorist movement”, which directly and thinly implies that he believes that the GOP should be outlawed. Terrorists are criminals of the most dangerous kind, law enforcement should act on criminals (from most to least dangerous), ergo anything designated as “terrorist” should be criminalized. The Republicans aren’t the ones who are trying to impose federal election standards on all states in blatant disregard for state sovereignty. The Republicans aren’t the ones directing social media to censor anyone who questions the mRNA COVID “vaccine” (under thinly veiled threat of regulation). The Republicans don’t enjoy the support of an armed group that sets fire to federal buildings, starts firefights in the street, and seizes city blocks to turn into lawless zones. The Republicans aren’t the party where almost half its membership wants to put the unvaccinated in concentration camps (and lest a Democrat apologist point to Trump’s policy of detaining migrants, recall that Biden is doing the same thing but at even higher rates then Trump). So if anyone party is a front for terrorists (IF, which is not to say that it is), it would be the Democratic Party. 
2022-01-17;https://twitter.com/0rf/status/1483162321191149574;Data from Israel shows that a 4th dose of the Pfizer mRNA COVID “vaccine” offers almost no more protection against the Omicron variant of COVID than a 3rd dose—since even 3 doses still wasn’t enough to prevent many vaccinated people from getting COVID, this means that the vaccines don’t work. The “vaccine” may have been effective against the “wild type” (i.e. original), but if 3 doses won’t prevent infection and 4 is barely any better, the vaccinated have no more recourse. There’s nowhere left to go, and the virus will only continue to mutate to evade the vaccine for as long as people continue to take more doses of it. 
2022-01-18;https://www.youtube.com/watch?v=bnMMYJKZvnU;In a candid interview, Dr. Cyrille Cohen, one of Israel’s top immunologists and a member of the Israeli government’s vaccine advisory committee, noted that (1) the Omicron wave will not be over until everyone—regardless of vaccination—has sustained an Omicron infection, (2) schools should have never been closed at any point during the COVID pandemic, and (3) testing for all individuals—again, regardless of vaccination—is much more effective at reducing the spread of Omicron than requiring patrons of indoor businesses to show proof of vaccination (referred to in Israel as “green passes”). All of this eminently rational, borne out by ample available evidence. In spite of this, though, Democrat-controlled American cities continue to impose vaccine mandates to stop the spread of Omicron, with Boston being the most recent example as of this writing. There is also no indication that any jurisdictions in the US will impose testing requirements in lieu of vaccine mandates, though this could be because of limited test availability and processing capacity. Even so, such commonsense measures are not even being entertained in the US, certainly not by Democrats, despite their vocal claims to “follow the science”. What more evidence does one need that Democrat-imposed vaccine mandates are not about public health but demanding submission to the state (controlled by Democrats, of course)?
2022-01-19;https://twitter.com/ggreenwald/status/1483907335181455369, https://twitter.com/ggreenwald/status/1485961964044095496;Democrat supporters are now calling for Tucker Carlson to be imprisoned for making a rational case against going to war with Russia to defend Ukraine. Reasonable people can disagree about whether or not to intervene in Russia’s impending (by Biden’s own admission) invasion of Ukraine. There are sound arguments for either side of the issue. But because the consensus Democrat talking point is that we should go to war with Russia—despite the fact that the Biden administration essentially said it would do nothing more than sanction Russia—now the party’s loyal foot soldiers are calling for dissenters to be imprisoned as Russian collaborators and traitors. This should alarm every American. It is outrageous to label as treasonous the making of a case that would spare American lives and tax dollars which also happens to benefit a hostile foreign power. Or does this stem from Democrat supporters’ desire to believe the demonstrable fiction that the Republican party is an ally of Russia? It would certainly be strange for the party whose last president (Trump) was targeted by a hoax accusation of collusion with Russia and who saw no major Russian incursions into foreign states to be pro-Russian, and not the party who saw a Russian incursion during the administration of their last president (Obama) and is about to see another one under their current president (Biden) all while dropping opposition to a major Russian pipeline to Germany. But psychological projection is the archetypal Democrat pathology: the Democrats accuse their opponents of what they themselves are guilty of. Democrats were lukewarm at best on the last round of sanctions against Russia, and gave Putin a huge boon by dropping opposition to a Russia-Germany oil pipeline that will bring windfall revenue to Russia. But then they turn around and accuse the Republicans, who pushed for the same sanctions Democrats largely didn’t support, of being soft on Russia. As a good rule of thumb, if the Democrats accuse their opponents of something, there’s a good chance they’re guilty of that same accusation—the more vociferous the condemnation, the more hypocritically guilty they are likely to be. 
2022-01-19;https://www.bloomberg.com/news/articles/2022-01-19/mrna-boosters-don-t-block-omicron-south-african-study-shows;A study published in The Lancet suggests that even boosters of the mRNA COVID “vaccines” do a poor job of preventing infection. A reasonable person would typically expect something characterized as a “vaccine” to prevent infection, as traditional vaccines confer what is called “sterilizing immunity”, a complete resistance to future infections. But not only do the initial 2 doses not prevent mRNA shot recipients from getting Omicron, but a third dose doesn’t even do so. At this point, how can anyone who regards their critical thinking as rational and evidence-based argue that these vaccines are effective, even if they do in fact reduce the severity of Omicron cases?
2022-01-19;https://www.statnews.com/2022/01/19/those-who-recovered-from-covid-19-were-less-likely-than-vaccinated-to-get-infected-during-delta-wave/, https://fox8.com/news/coronavirus/natural-immunity-was-more-effective-than-vaccines-alone-against-delta-variant-cdc-study-shows/;Data shows that those who contracted and recovered from COVID were more likely to avoid an infection with the Delta variant than those who were “vaccinated” using the mRNA COVID shots. It bears repeating that anyone with a high school biology education could have reasoned this to be the case. An immune system which has successfully fended off a real COVID infection will be far more robust than one which only created antibodies from the mRNA-derived spike proteins. This is because the real virus kills human cells and replicates virally, and so the immune system must respond faster to limit the spread, whereas the disembodied spike proteins created from the mRNA “vaccines” neither replicate nor directly kill cells. This being the case, why doesn’t every vaccine mandate have a carve-out for proof of natural immunity? Shouldn’t those with natural immunity be exempt from COVID vaccine requirements, since they’re better protected anyway? Such a policy would not lend itself to the real goal of the vaccine mandates (which, one should recall, are only pushed by Democrats), which is to demand citizens’ obedience to the (Democrat-controlled) state. 
2022-01-20;https://greenwald.substack.com/p/congresss-16-committee-claims-absolute;The Democrat-run January 6 committee has appointed itself practically unlimited investigatory power, arguing that it is unconstrained by warrant requirements for investigating anyone at any time for any reason. The actions of this committee are worse than the House Un-Ameriacn Activities committee headed by McCarthy: instead of seeking out communist infiltrators to the US government, the January 6 committee is hunting down rioters who trespassed on federal property for 3 hours and inflicted no more harm than breaking a few windows and bruising a few police officers (all of which should be duly prosecuted, as every American should support). Worse, there is no reason why this committee couldn’t turn its prying eye into the affairs of anyone the Democrats can even tangentially connect to the riots on January 6. The unchecked actions of the committee open the door to future abuse at the very least, and signal the beginning of the de facto outlawing of the Republican Party at the very most.
2022-01-20;https://www.bbc.co.uk/news/world-us-canada-60063594;As Biden stares down abysmal approval ratings and no end in sight for their main cause, inflation, he has already declared that the 2022 midterm elections may not be “legit”. If Trump had done this, he would be slammed by every major news outlet (since they all serve as free PR for the Democrats) and there would be protests in every major city in America. Part of his declaration hinges on the fact that Congress failed to pass his voting rights bill which, among other things, would institute a federal election authority to mandate how states must conduct elections, flouting states’ sovereignty to elect their representatives as they choose. It also makes unflattering implications that don’t exactly help Biden. If the US has had literally hundreds of elections over the course of its history, all of them held before Biden’s voting rights legislation, is he saying that all of those were illegitimate too because they didn’t adhere to his proposed voting legislation? Wouldn’t he, by extension, be saying that his own election to the presidency wasn’t above board? If not adhering to his voting rights measures makes an election suspect, then every election in the nation’s history has been suspect. And then a further implication is, if the Democrats are saying every election is suspect, what right do they have to condemn Trump for questioning the 2020 election? The Democrats themselves implied that every election ever held in America is not to be trusted. But at the same time they maintain that the 2020 election—in which they disregarded voting laws in several states to allow unverifiable mail-in ballots—was the most secure and trustworthy election of all time. This just shows how inconsistent, opportunistic, and stupid the Democrats are. When they’re on track to lose an election that is just under a year away, they’ll claim that no election has ever been trustworthy, but then when Republicans call their bluff and question the 2020 election, they backpedal and assert that 2020 was the most trustworthy election of all time. 
2022-01-21;https://twitter.com/ggreenwald/status/1484535272754884611;Pundit after pundit—dozens of them—have declared that if Trump, who won an election for president fair and square and who stepped down as president at the appointed date and time upon losing less than 100% fair and square, were reelected then democracy in America would collapse. It is pretty galling that the press, which on the whole sides with the Democrats at every turn, can proclaim that democracy will die if the Democrats’ most hated opponent wins a free and fair election. It is even more audacious that they do so as their Democrat friends take away peoples’ freedoms by enacting vaccine mandates and online censorship against anyone who questions the vaccines being mandated. How does anyone believe the blatant hypocrisy of a political party, via their steadfast press allies as proxy, saying democracy dies if their opponents win a democratic election? 
2022-01-24;https://twitter.com/coldxman/status/1485703543046746118;The same people, the Democrats, who are screaming that states can’t require IDs to vote because it discriminates against non-white people have no problem requiring IDs to go out to eat or go to a gym and supposedly discriminating against this same minority group. This is because the Democrats have no principles, other than staying in power and controlling others by any means necessary. They have no consistency on matters of even the most deeply professed morality. They will say and do anything to justify wielding power over you and controlling you. They’ll condemn ID requirements as racist when it might possibly prevent their base from voting for them, but they will welcome IDs to cast out the unvaccinated as filthy second-class citizens despite the clear scientific fact that they pose no greater risk to spreading COVID than the vaccinated. 
2022-01-24;https://www.axios.com/health-care-workers-breaking-point-b7203b26-55dc-4990-952e-40ececed652d.html;Health care workers are complaining that they are burned out and understaffed, yet they fired their unvaccinated colleagues willing to work and assume any risks. These doctors and nurses have no leg to stand on, and no one to blame but themselves. 
2022-01-24;https://youtu.be/4zGXX6kDPBs;Data from the CDC shows that not only is natural immunity many times more effective than “vaccine” immunity for preventing COVID, but having both natural and “vaccine” immunity is negligibly more protective than natural immunity alone. As anyone who took high school biology can tell you, the antibodies developed from fighting a real infection of COVID are more robust than those developed from just seeing spike proteins created from mRNA instructions, because the former can form as a response to any and all parts of the virus rather than just the spike protein. How is it we are only hearing about this now, roughly 2 years into the pandemic? Did the CDC really not think to study this until recently? Or did they not release it until now because they wanted to keep pushing the mRNA “vaccine”?
2022-01-25;https://www.axios.com/fda-limits-regeneron-lilly-covid-treatments-use-a28bffec-7680-4eae-a2f8-4fc957e01379.html;Despite the fact that the treatment is safe and no less effective against he Omicron variant than the mRNA “vaccines”, the FDA is restricting access to monoclonal antibodies on the grounds that they aren’t effective. If the FDA is going to limit treatments because of poor effectiveness against Omicron, then how come they haven’t limited the mRNA COVID “vaccines”, which are substantially more likely to lead to dangerous side effects than antibody treatments? Is it because many of the FDA’s political patrons and allies own stock in Pfizer, and the “vaccine” is significantly more profitable than antibody treatments? Is it because many of the experts on the FDA’s advisory panel have financial and professional ties to Pfizer? Or is it because they just want to make sure Americans don’t use a safe treatment because it might not work? 
2022-01-25;https://arstechnica.com/tech-policy/2022/01/osha-will-try-a-different-route-to-a-vaccine-mandate-for-businesses/;After its attempts to push a nationwide vaccine mandate that would sweep up most American workers were rebuffed by the Supreme Court, OSHA is trying to find a new way to compel Americans to get the COVID vaccine. What’s even more audacious about this is that, in the time between OSHA’s announcement of its first vaccine mandate and now, the evidence has surfaced that the vaccine does not stop the spread and does not stop vaccinated individuals from contracting COVID—no less than the FDA head tacitly admitted the former and the head of the CDC explicitly admitted the latter. So on what grounds does OSHA think it can push ineffective vaccines—ineffective at least for the variant we have now, regardless of how well they handled earlier ones—now?
2022-01-25;https://twitter.com/ggreenwald/status/1485756706021941261;CNN “journalist” Brian Stelter condemned Trump for referring to a journalist as a “son of a bitch”, but issued no comparable expression of condemnation when Biden said the same thing RIGHT IN FRONT of the intended target. It is hard to find clearer proof that the corporate media is squarely on the side of the Democrats, giving them a pass for offenses for which they pillory the Republicans. When Trump mocks the press, the press cries state repression, but when Biden does it, they’re in on the joke. 
2022-01-25;https://twitter.com/@esaagar/status/1485985314971729921;The journalist who was the target of Biden’s derisive “son of a bitch” comment was gracious enough to publicly and graciously accept Biden’s apology over his remarks. To Biden’s credit, he did the right thing in apologizing for his remark, a courtesy Trump would never have done. The issue, though, is not with Biden for making the distasteful remark about an adversarial journalist doing his job: the issue is with the press for going nowhere near to castigating Biden for it the way they did when Trump uttered the same words against a journalist. 
2022-01-25;https://www.haaretz.com/israel-news/.premium.HIGHLIGHT.MAGAZINE-when-i-told-pfizer-about-the-myocarditis-they-refused-to-believe-me-for-4-months-1.10564613;A doctor in Israel notified Pfizer that their vaccines had a link to myocarditis, but Pfizer ignored him. Is this the behavior of a responsible drug company with nothing to hide? What reason could they possible have to ignore warnings from doctors working on the front lines? How can any reasonable person not view this as suspicious? 	
2022-01-26;https://www.axios.com/stock-market-2022-worst-start-year-ever-73c15533-b443-4290-8693-c215df7a44ab.html;The stock market is off to the worst start to a year ever, under Biden’s first full month of January in office, and after a year of exceptional mismanagement of the economy. Biden ran on fixing the pandemic economy that Trump supposedly produced, but which Biden’s Democrat allies in state governorships largely induced via draconian lockdowns in 2020, and now he is failing to deliver on his promises. This shows staggering incompetence: how ineptly must you be managing the economy if your party destroys the economy by legally forcing businesses to close and you can’t get it to recover just by lifting most (if not all) restrictions on business operation? The left obsessively insisted the Trump made Americans’ lives worse, but what is worse than the economy destroying Americans’ investments—including retirement investments—under his watch?
2022-01-26;https://www.dailywire.com/news/biden-surgeon-general-suggests-joe-rogan-podcast-should-be-censored-big-tech-has-important-role-to-play;Biden’s Surgeon General is encouraging tech companies to censor anyone who disagrees with the government’s official position, as if the government has any right to ask the private sector to censor their opponents for them. As noted previously, the Supreme Court has ruled that it is unconstitutional for the government to coerce a private company, via explicit or implicit threat of retaliation, to censor their political adversaries on their behalf. How much more corrupt and authoritarian is it that the bureaucrat under a Democrat president is pushing Big Tech to censor their opponents when Big Tech employees overwhelmingly donate to Democrats (versus Republicans), as publicly available FEC filings clearly show? And, of course, the biggest litmus test of all whether Democrats and their supporters would tolerate this scenario if the shoe was on the other foot: would the left accept it if a Republican presidential administration’s Surgeon General told Republican-aligned Big Tech to censor a liberal critic? Of course not, and they would be right to take that point of view—freedoms should be respected irrespective of political viewpoints. 
2022-01-27;https://twitter.com/Breaking911/status/1486781883253993473;A car belonging to Congresswoman Cori Bush, who has vocally called for defunding the police, was struck by gunfire while it was parked. Even a 9-year-old could tell you that when there are less police there will be more crime. Bush has only herself to blame for this: if she didn’t want criminals shooting up her car, she shouldn’t have backed the diminution of police forces across America. 
2022-01-28;https://www.axios.com/coronavirus-contact-tracing-public-health-omicron-61231b48-b17b-4455-aa6a-a0fbf8400678.html;Democrats have decided that, while they want to eject the unvaccinated from society to limit the spread of COVID even though the more numerous vaccinated spread it just as easily, they don’t want to bother with contact tracing, which actually DOES limit the spread of disease. Although certainly not a panacea, contact tracing does make a tangible difference. It allows infected individuals to contact those with whom they’ve been in contact so that those individuals in turn can isolate early, reducing the spread of COVID if they test positive, until they test negative for COVID. Vaccine mandates, on the other hand, don’t work considering that (1) the vaccinated spread COVID at the same rate as the unvaccinated, (2) there are more vaccinated people in most areas than unvaccinated, and (3) the vaccinated are less likely to get tested, since they have been assured (until recently) that the vaccine makes them invulnerable to COVID, than the unvaccinated, who are not only aware that they are at risk for COVID (and take appropriate precautions) but are in some cases under obligation from their workplace to test for COVID weekly (allowing for the detection of asymptomatic cases where the vaccinated do not). It is quite strange that the Democrats defy this line of reasoning considering that they profess themselves to be the “pro-science” political party—unless it was never about science or public health but merely about controlling the populace and punishing those with whom they disagree.  
2022-01-28;https://www.axios.com/biden-near-term-troops-ukraine-6e46b3eb-af54-4837-99cd-968674e4dd06.html;Despite assuring Russia that the US would not intervene militarily if it invaded Ukraine (instead threatening sanctions), Biden is sending US troops to the vicinity of Ukraine. What message is this supposed to send to Russia? Sending mixed signals in the arena of international diplomacy can lead to misunderstandings with catastrophic consequences. If Russia antagonizes US troops because it calls the US’s bluff that it won’t intervene, US troops do take action when Biden assured Russia they would not, or any number of other miscommunications transpires, it could easily spiral into direct war between 2 nuclear armed states. What does Biden think America will get out of taking this colossal risk? 
2022-01-28;https://twitter.com/libsoftiktok/status/1487164691772227586;A passenger on a Spirit Airlines passenger was told to cover his mask because the tongue-in-cheek (and not at all profane) anti-Biden slogan depicted on it, “Let’s Go Brandon”, was “offensive” to the other passengers. It would be one thing if the passenger was displaying racial slurs on his person: in that case, fellow passengers could understandably take offense. But essentially the political speech of his mask was the equivalent of expressing “I don’t like Joe Biden”, which we SHOULD all agree should be tolerated even if it is at odds with one’s own opinion. But literally the other passengers bullied a passenger with whom they politically disagreed. During Trump’s term in office, many Democrat supporters proclaimed “Fuck Trump” and incurred few, if any, consequences. I dare anyone to produce evidence of a passenger being told to remove or cover clothing that said “Fuck Trump”. Robert DeNiro even uttered this phrase on network television during the Tony Awards broadcast and was cheered rather than condemned by mainstream popular culture. This is another example of the Democrat-constructed double standard: you can criticize Republicans with as vulgar language as you want, but you can’t criticize Democrats even in mild language. 
2022-01-29;https://twitter.com/AmyBeePhoenix/status/1487484029762945028;Merriam-Webster quietly changed their definition of “vaccine” during the pandemic, such that it went from containing inactivated microorganisms and conferring “immunity” to simply “stimulat[ing] the body’s immune response”—a change in definition which just so happens to go from not characterizing the mRNA COVID immunotherapy injections to characterizing them as such. Why is Merriam-Webster so concerned that the mRNA injections are classifiable as “vaccines” when they do not meet the traditional definition of vaccine? What do they have to gain from calling the mRNA injections vaccines? And what’s wrong with these injections NOT being vaccines? If the mRNA COVID immunotherapy injections are safe and effective, why should it matter if they count as vaccines or not? The answer is the pharma companies, the government, or both determined that people would be more willing to trust in the safety of the mRNA injections if they traded on the trustworthiness that most people regard real vaccines as having. In other words, it’s a con: by calling something a vaccine that’s not, people trust it like they trust real vaccines, a move which pharma and/or government would only pull if there was some reason not to trust the mRNA COVID shots. 
